{"profile":"apple-portable-v1","rules":[{"applicability":"Apple profile only; recognized USDA layers after safe container indexing. Skip when layer kind cannot be established.","category":"appleCompatibility","defaultSeverity":"warning","description":"Text USD delivery advisory in Apple profile.","family":"container","rationale":"Binary USD is the frozen portability recommendation; current Apple systems may support USDA. This advice neither certifies a renderer nor requires a single layer.","ruleID":"UVK-APL-001","title":"Prefer binary USD delivery"},{"applicability":"Apple profile only; recognized EXR or AVIF texture members after safe container indexing.","category":"appleCompatibility","defaultSeverity":"warning","description":"EXR/AVIF outside the conservative PNG/JPEG Apple profile baseline.","family":"budgets","rationale":"PNG/JPEG is the frozen portability recommendation; current Apple systems may support EXR or AVIF. This advice does not certify renderer compatibility.","ruleID":"UVK-APL-002","title":"Prefer PNG or JPEG textures"},{"applicability":"ZIP records whose required bytes or field ranges can be checked within the safety envelope. Unsupported features use a limitation when malformedness is not established.","category":"archiveSpecification","defaultSeverity":"error","description":"Established malformed/truncated ZIP record or invalid field range.","family":"container","rationale":"A container cannot be trusted when required records are malformed or truncated.","ruleID":"UVK-ARC-001","title":"Malformed ZIP record"},{"applicability":"Supported classic single-disk ZIP records after bounded metadata reads. Skip downstream checks whose ownership cannot be established.","category":"archiveSpecification","defaultSeverity":"error","description":"Contradictory local/directory records, overlapping ownership, or unindexed members.","family":"container","rationale":"Directory and local records must describe consistent, nonoverlapping ownership of the package bytes.","ruleID":"UVK-ARC-002","title":"Contradictory ZIP ownership"},{"applicability":"Safely indexed stored regular payloads that can be read completely within the safety envelope. Skip unsupported or unavailable payloads.","category":"archiveSpecification","defaultSeverity":"error","description":"Stored payload CRC mismatch.","family":"container","rationale":"The recorded CRC must match the encoded stored payload.","ruleID":"UVK-ARC-003","title":"Stored payload CRC mismatch"},{"applicability":"Entries with established method and size fields, including zero/zero stored entries. Reject nonempty/zero claims before payload interpretation.","category":"archiveSpecification","defaultSeverity":"error","description":"Nonzero compression method or unequal stored/uncompressed sizes.","family":"container","rationale":"The supported USDZ container uses stored payloads with equal encoded and uncompressed sizes.","ruleID":"UVK-ARC-004","title":"Entry is not stored one-to-one"},{"applicability":"Entries whose ZIP encryption flags can be read conclusively.","category":"archiveSpecification","defaultSeverity":"error","description":"Encrypted entry.","family":"container","rationale":"Encrypted entries are outside the permitted USDZ stored-container form.","ruleID":"UVK-ARC-005","title":"Encrypted entry"},{"applicability":"Regular entries with safely established physical payload offsets; directory entries have no payload-alignment obligation.","category":"archiveSpecification","defaultSeverity":"error","description":"Regular-file payload is not 64-byte aligned.","family":"container","rationale":"USDZ regular-file payloads require 64-byte alignment.","ruleID":"UVK-ARC-006","title":"Unaligned regular payload"},{"applicability":"USD members with enough safely readable signature bytes for a conclusive mismatch. Insufficient bytes do not establish a mismatch.","category":"archiveSpecification","defaultSeverity":"error","description":"Obvious USD suffix/signature mismatch.","family":"container","rationale":"A USD filename must not contradict its recognizable text or binary signature.","ruleID":"UVK-ARC-007","title":"USD suffix and signature disagree"},{"applicability":"Known input byte size with archiveBytes enabled; warn only when observed bytes exceed the threshold.","category":"policy","defaultSeverity":"warning","description":"Archive byte budget exceeded.","family":"budgets","rationale":"Encoded archive bytes are a configurable project delivery budget, separate from hard safety limits.","ruleID":"UVK-BUD-001","title":"Archive byte budget exceeded"},{"applicability":"Safely indexed regular entries with fileBytes enabled; warn only when encoded bytes exceed the threshold.","category":"policy","defaultSeverity":"warning","description":"Per-file encoded-byte budget exceeded.","family":"budgets","rationale":"A per-file encoded-byte warning identifies large package members without decoding them.","ruleID":"UVK-BUD-002","title":"File byte budget exceeded"},{"applicability":"Established regular-entry count with fileCount enabled; warn only when the count exceeds the threshold.","category":"policy","defaultSeverity":"warning","description":"Regular-file-count budget exceeded.","family":"budgets","rationale":"Regular-file count is a configurable delivery-complexity budget; directories do not count.","ruleID":"UVK-BUD-003","title":"File count budget exceeded"},{"applicability":"Recognized texture members with textureBytes enabled and established stored sizes; warn only above the threshold.","category":"policy","defaultSeverity":"warning","description":"Per-texture encoded-byte budget exceeded.","family":"budgets","rationale":"Encoded texture bytes measure delivery cost without decoding pixels.","ruleID":"UVK-BUD-004","title":"Texture byte budget exceeded"},{"applicability":"Safely indexed recognized textures with totalTextureBytes enabled; warn only when their encoded-byte sum exceeds the threshold.","category":"policy","defaultSeverity":"warning","description":"Total encoded texture-byte budget exceeded.","family":"budgets","rationale":"Aggregate encoded texture bytes are a project budget independent of decoded memory cost.","ruleID":"UVK-BUD-005","title":"Total texture byte budget exceeded"},{"applicability":"textureMaxDimension enabled and conclusive dimensions from a supported PNG/JPEG header within the scan boundary; warn only above the threshold.","category":"policy","defaultSeverity":"warning","description":"Supported texture width or height exceeds the dimension budget.","family":"budgets","rationale":"Width or height is advisory delivery policy; no pixel decoding or decoded-memory estimate is performed.","ruleID":"UVK-BUD-006","title":"Texture dimension budget exceeded"},{"applicability":"Supported PNG/JPEG headers with enough readable bytes to establish malformedness during an enabled dimension check.","category":"policy","defaultSeverity":"error","description":"Conclusively malformed supported texture header.","family":"budgets","rationale":"Conclusive malformedness is a policy error; unavailable or unsupported dimensions instead produce an explicit limitation when requested.","ruleID":"UVK-BUD-007","title":"Malformed texture header"},{"applicability":"ZIP64, data descriptors, unsupported layouts, encodings, or type semantics where supported inspection cannot continue conclusively.","category":"validatorLimitation","defaultSeverity":"warning","description":"Unsupported ZIP feature, layout, encoding, or type semantics.","family":"container","rationale":"A processing boundary makes affected native coverage incomplete; it must not turn established malformed records into mere limitations.","ruleID":"UVK-LIM-001","title":"Unsupported ZIP semantics"},{"applicability":"Recognized binary USD layers; package-local reference inspection cannot parse USDC dependencies in v0.1.","category":"validatorLimitation","defaultSeverity":"warning","description":"Binary USD reference inspection unavailable.","family":"references","rationale":"Recognizing a binary signature does not prove complete USD reference validation.","ruleID":"UVK-LIM-002","title":"Binary references not inspected"},{"applicability":"Recognized asset expressions, templates, or package identifiers outside the supported literal path subset.","category":"validatorLimitation","defaultSeverity":"warning","description":"Expression/template/package identifier cannot be resolved natively.","family":"references","rationale":"The validator does not evaluate expressions, composition, or nested package identifiers and cannot infer their targets.","ruleID":"UVK-LIM-003","title":"Unsupported asset identifier"},{"applicability":"Recognized text USD whose encoding is outside the supported bounded USDA scanner.","category":"validatorLimitation","defaultSeverity":"warning","description":"Recognized USD text cannot be scanned in its supported encoding.","family":"references","rationale":"Unscannable recognized text leaves reference coverage incomplete without inventing missing-reference findings.","ruleID":"UVK-LIM-004","title":"USD text encoding not scanned"},{"applicability":"textureMaxDimension enabled; unsupported formats, unsupported header variants, or no conclusive dimensions within the 1 MiB header scan boundary.","category":"validatorLimitation","defaultSeverity":"warning","description":"Requested texture dimensions unavailable within the supported boundary.","family":"budgets","rationale":"Dimension coverage must be explicit when bounded PNG/JPEG inspection cannot provide a result; the scan boundary alone is not a hard safety error.","ruleID":"UVK-LIM-005","title":"Texture dimensions unavailable"},{"applicability":"Recognized nested .usdz members after safe container indexing; no recursive package inspection.","category":"validatorLimitation","defaultSeverity":"warning","description":"Nested package content not inspected.","family":"container","rationale":"The native engine does not extract or recursively inspect nested package